{
  "schema_version": "1.0.0",
  "candidate_id": "CAND-SUPPORT-2026-07-31",
  "artifact_status": "final",
  "evidence": [
    {"evidence_id": "EVID-EVALUATION", "evidence_type": "evaluation_report", "candidate_id": "CAND-SUPPORT-2026-07-31", "path": "artifacts/evaluation-report.md", "sha256": "71bc7363ef60fb19ae379b3416832348d981edd80d28fc42fd493023687d5049", "produced_at": "2026-07-30T12:00:00Z", "valid_until": "2026-10-30T12:00:00Z", "status": "pass", "scope": "Full fictional Tier 3 release evaluation against evaluation set version 1.0.0.", "owner_actor_id": "ACT-SYSTEM", "verifier_actor_id": "ACT-INDEPENDENT"},
    {"evidence_id": "EVID-SECURITY", "evidence_type": "security_report", "candidate_id": "CAND-SUPPORT-2026-07-31", "path": "artifacts/security-report.md", "sha256": "5203f0ec8495b8bca1c280565fcde78ba4e37cf559117b1222fb8adfbcb32b83", "produced_at": "2026-07-30T10:00:00Z", "valid_until": "2026-10-30T10:00:00Z", "status": "pass", "scope": "Authorization, isolation, rendering, resource, data-boundary, and configuration review.", "owner_actor_id": "ACT-SYSTEM", "verifier_actor_id": "ACT-SECURITY"},
    {"evidence_id": "EVID-REDTEAM", "evidence_type": "red_team_report", "candidate_id": "CAND-SUPPORT-2026-07-31", "path": "artifacts/red-team-report.md", "sha256": "da2d39935a344635ebf480f528f100f87484640ed4d0532f5a529858785eb508", "produced_at": "2026-07-30T11:00:00Z", "valid_until": "2026-10-30T11:00:00Z", "status": "pass", "scope": "Authorized fictional attack coverage across injection, disclosure, tenant, egress, and resource objectives.", "owner_actor_id": "ACT-SYSTEM", "verifier_actor_id": "ACT-SECURITY"},
    {"evidence_id": "EVID-PRIVACY", "evidence_type": "privacy_data", "candidate_id": "CAND-SUPPORT-2026-07-31", "path": "artifacts/privacy-data-assessment.md", "sha256": "ac2f18f3c93c610e2b04fdb94e91ed8ee2cb7c00f6af8a264334a80ff924d98e", "produced_at": "2026-07-30T13:00:00Z", "valid_until": "2027-01-30T13:00:00Z", "status": "pass", "scope": "Fictional data authority, minimization, access, retention, deletion, and provider review.", "owner_actor_id": "ACT-SYSTEM", "verifier_actor_id": "ACT-PRIVACY"},
    {"evidence_id": "EVID-GRADER", "evidence_type": "model_grader_validation", "candidate_id": "CAND-SUPPORT-2026-07-31", "path": "artifacts/model-grader-validation.md", "sha256": "04857bc34b228e61747bf10ecd77da2e3fe08aa29e276b84064bde984d37d9ca", "produced_at": "2026-07-30T09:00:00Z", "valid_until": "2026-10-30T09:00:00Z", "status": "pass", "scope": "Fictional supported-claim grader validation against adjudicated labels and bias checks.", "owner_actor_id": "ACT-SYSTEM", "verifier_actor_id": "ACT-INDEPENDENT"},
    {"evidence_id": "EVID-MONITORING", "evidence_type": "monitoring_plan", "candidate_id": "CAND-SUPPORT-2026-07-31", "path": "artifacts/monitoring-plan.md", "sha256": "890d271af4b3b344d827e24f32c62b37d791920c1f6a378899a3dc514e5df943", "produced_at": "2026-07-29T15:00:00Z", "valid_until": "2027-01-29T15:00:00Z", "status": "pass", "scope": "Fictional safety, security, quality, retrieval, evaluator, and operational monitoring plan.", "owner_actor_id": "ACT-SYSTEM", "verifier_actor_id": "ACT-INDEPENDENT"},
    {"evidence_id": "EVID-INCIDENT", "evidence_type": "incident_plan", "candidate_id": "CAND-SUPPORT-2026-07-31", "path": "artifacts/incident-plan.md", "sha256": "e5ba87c19a12328f8dfc9512892f3d9b3b76b19d88d68425d4e4bd38702be66e", "produced_at": "2026-07-29T16:00:00Z", "valid_until": "2027-01-29T16:00:00Z", "status": "pass", "scope": "Fictional detection, containment, notification assessment, recovery, and learning process.", "owner_actor_id": "ACT-SYSTEM", "verifier_actor_id": "ACT-SECURITY"},
    {"evidence_id": "EVID-ROLLBACK", "evidence_type": "rollback_exercise", "candidate_id": "CAND-SUPPORT-2026-07-31", "path": "artifacts/rollback-exercise.md", "sha256": "cd6a5d82a63a7cb589bd7128f6a182278120d083a5264c5ab2d37e77dd919479", "produced_at": "2026-07-30T08:00:00Z", "valid_until": "2027-01-30T08:00:00Z", "status": "pass", "scope": "Fictional disable-and-route-to-human rollback exercise for the exact candidate configuration.", "owner_actor_id": "ACT-SYSTEM", "verifier_actor_id": "ACT-INDEPENDENT"},
    {"evidence_id": "EVID-OVERSIGHT", "evidence_type": "human_oversight", "candidate_id": "CAND-SUPPORT-2026-07-31", "path": "artifacts/human-oversight.md", "sha256": "5aca250f8a98807d6ae1d4d02840f191fe8758ac36fa89d76a902924448c95dc", "produced_at": "2026-07-29T14:00:00Z", "valid_until": "2027-01-29T14:00:00Z", "status": "pass", "scope": "Fictional operator information, intervention, escalation, override, and disable assessment.", "owner_actor_id": "ACT-SYSTEM", "verifier_actor_id": "ACT-INDEPENDENT"},
    {"evidence_id": "EVID-INJECTION-RETEST", "evidence_type": "other", "candidate_id": "CAND-SUPPORT-2026-07-31", "path": "artifacts/injection-retest.md", "sha256": "928f62b717f8fa17a2230dfdec15e885a795aa7675fcf99bb5d5aad9366fb503", "produced_at": "2026-07-30T11:30:00Z", "valid_until": "2026-10-30T11:30:00Z", "status": "pass", "scope": "Targeted fictional retest of the remediated remote-preview injection finding.", "owner_actor_id": "ACT-CONTROL", "verifier_actor_id": "ACT-SECURITY"}
  ]
}
